{
  "version": 1,
  "trial_id": "trial-41c7a1",
  "build_spec_digest": "c8b19e46a926aba5b2e4d5df4fc719e696dc8a97fd0bffa234727f0c43bd088f",
  "module": {
    "path": "go.etcd.io/raft/v3",
    "version": "v3.6.0"
  },
  "source_path": "raft.go",
  "input_source_digest": "4283c10e12c6da14964c6d6784a69851af1312245aa83925ec0e9426a07ed7bb",
  "output_source_digest": "e1e771d229a585d567c5fdc3335fdf136764d033cd853acfa8f312f6e7407b41",
  "sut_build_identity": "sut-d3e2b40dc3993d40",
  "binary_path": "artifacts/pilots/etcdraft-calibration-v1/bin/sut-d3e2b40dc3993d40",
  "binary_digest": "1d029c5d2c3595fd669473d7cfde416f04d329d8d709a5a3c7a0b337b70f1f87",
  "command_identity": "2b4744b52f1567dab3766142b07492eff21affd718332a4bb52f070b01f336f1",
  "commands": [
    {
      "identity": "go-list-module",
      "digest": "31180163a6c1039d91283d0e6033726684c7630e6a022010380d5fe2c7b5bb5d",
      "executable": "go",
      "logical_args": [
        "list",
        "-mod=readonly",
        "-m",
        "-json",
        "go.etcd.io/raft/v3"
      ],
      "environment": [
        "GOPROXY=off",
        "GOSUMDB=off",
        "GOWORK=off",
        "GOFLAGS=",
        "GOTOOLCHAIN=local"
      ],
      "command_policy": "exact-allowlist-v1"
    },
    {
      "identity": "go-build",
      "digest": "ef00c20413d0cf05447814b1ba54a4f14e61cc6cf7d9d6b0d700837d6bd10432",
      "executable": "go",
      "logical_args": [
        "build",
        "-mod=readonly",
        "-trimpath",
        "-buildvcs=false",
        "-modfile=\u003cgenerated\u003e",
        "-ldflags=-buildid= -X=github.com/SuzumiyaHaruki/consensus-atlas/drivers/etcdraft.SUTBuildIdentity=sut-d3e2b40dc3993d40",
        "-o",
        "artifacts/pilots/etcdraft-calibration-v1/bin/sut-d3e2b40dc3993d40",
        "./cmd/campaign"
      ],
      "environment": [
        "GOPROXY=off",
        "GOSUMDB=off",
        "GOWORK=off",
        "GOFLAGS=",
        "GOTOOLCHAIN=local"
      ],
      "command_policy": "exact-allowlist-v1"
    }
  ],
  "toolchain_identity": "go1.25.8/linux/amd64",
  "module_cache_unmodified": true,
  "offline_readonly_build": true,
  "exact_match_count": 1
}
